2025-11-11 22:34:32 - INFO - Using device: cuda
2025-11-11 22:34:32 - INFO - GPU: NVIDIA GeForce RTX 3090 (23.7 GB)
2025-11-11 22:34:33 - INFO - Starting Comprehensive SARI Benchmark Evaluation
2025-11-11 22:34:33 - INFO - Output directory: evaluation_results/model_card_20251111_095937/greedy_speed/sari_benchmark_20251111_223433
2025-11-11 22:34:33 - INFO - Loading test dataset...
2025-11-11 22:34:35 - INFO - Dataset loaded: 268783 total samples
2025-11-11 22:34:35 - INFO - Will evaluate on 100 samples
2025-11-11 22:34:35 - INFO - 
============================================================
2025-11-11 22:34:35 - INFO - Evaluating: llama-leesplank
2025-11-11 22:34:35 - INFO - ============================================================
2025-11-11 22:34:35 - INFO - Loading model: UWV/leesplank-noot-llama-3.2-3b (type: llama)
2025-11-11 22:34:35 - INFO - Loading model in BFloat16 (no quantization)...
`torch_dtype` is deprecated! Use `dtype` instead!
Loading checkpoint shards:   0%|          | 0/2 [00:00<?, ?it/s]Loading checkpoint shards:  50%|█████     | 1/2 [00:00<00:00,  1.42it/s]Loading checkpoint shards: 100%|██████████| 2/2 [00:00<00:00,  2.44it/s]Loading checkpoint shards: 100%|██████████| 2/2 [00:00<00:00,  2.20it/s]
Device set to use cuda:0
2025-11-11 22:34:37 - INFO - Model loaded successfully: UWV/leesplank-noot-llama-3.2-3b
2025-11-11 22:34:37 - INFO - Processing 100 samples...
Evaluating llama-leesplank:   0%|          | 0/100 [00:00<?, ?it/s]The following generation flags are not valid and may be ignored: ['temperature', 'top_p']. Set `TRANSFORMERS_VERBOSITY=info` for more details.
Evaluating llama-leesplank:   1%|          | 1/100 [00:10<17:24, 10.55s/it]Evaluating llama-leesplank:   2%|▏         | 2/100 [00:14<10:38,  6.51s/it]Evaluating llama-leesplank:   3%|▎         | 3/100 [00:16<07:04,  4.38s/it]Evaluating llama-leesplank:   4%|▍         | 4/100 [00:24<09:46,  6.11s/it]Evaluating llama-leesplank:   5%|▌         | 5/100 [00:29<08:46,  5.55s/it]Evaluating llama-leesplank:   6%|▌         | 6/100 [00:33<08:07,  5.19s/it]Evaluating llama-leesplank:   7%|▋         | 7/100 [00:35<06:29,  4.18s/it]Evaluating llama-leesplank:   8%|▊         | 8/100 [00:38<05:40,  3.70s/it]Evaluating llama-leesplank:   9%|▉         | 9/100 [00:41<05:02,  3.33s/it]Evaluating llama-leesplank:  10%|█         | 10/100 [00:42<03:58,  2.66s/it]You seem to be using the pipelines sequentially on GPU. In order to maximize efficiency please use a dataset
Evaluating llama-leesplank:  11%|█         | 11/100 [00:44<03:50,  2.59s/it]Evaluating llama-leesplank:  12%|█▏        | 12/100 [00:48<04:07,  2.82s/it]Evaluating llama-leesplank:  13%|█▎        | 13/100 [00:54<05:47,  3.99s/it]Evaluating llama-leesplank:  14%|█▍        | 14/100 [00:58<05:32,  3.87s/it]Evaluating llama-leesplank:  15%|█▌        | 15/100 [01:02<05:28,  3.86s/it]Evaluating llama-leesplank:  16%|█▌        | 16/100 [01:05<05:14,  3.74s/it]Evaluating llama-leesplank:  17%|█▋        | 17/100 [01:07<04:26,  3.21s/it]Evaluating llama-leesplank:  18%|█▊        | 18/100 [01:11<04:45,  3.48s/it]Evaluating llama-leesplank:  19%|█▉        | 19/100 [01:20<06:38,  4.92s/it]Evaluating llama-leesplank:  20%|██        | 20/100 [01:26<07:00,  5.25s/it]Evaluating llama-leesplank:  21%|██        | 21/100 [01:28<05:59,  4.55s/it]Evaluating llama-leesplank:  22%|██▏       | 22/100 [01:33<05:57,  4.58s/it]Evaluating llama-leesplank:  23%|██▎       | 23/100 [01:37<05:37,  4.38s/it]Evaluating llama-leesplank:  24%|██▍       | 24/100 [01:38<04:12,  3.32s/it]Evaluating llama-leesplank:  25%|██▌       | 25/100 [01:43<04:41,  3.75s/it]Evaluating llama-leesplank:  26%|██▌       | 26/100 [01:46<04:38,  3.77s/it]Evaluating llama-leesplank:  27%|██▋       | 27/100 [01:52<05:23,  4.43s/it]Evaluating llama-leesplank:  28%|██▊       | 28/100 [01:56<04:50,  4.04s/it]Evaluating llama-leesplank:  29%|██▉       | 29/100 [02:00<05:03,  4.27s/it]Evaluating llama-leesplank:  30%|███       | 30/100 [02:02<03:53,  3.33s/it]Evaluating llama-leesplank:  31%|███       | 31/100 [02:12<06:27,  5.61s/it]Evaluating llama-leesplank:  32%|███▏      | 32/100 [02:17<06:05,  5.37s/it]Evaluating llama-leesplank:  33%|███▎      | 33/100 [02:21<05:25,  4.86s/it]Evaluating llama-leesplank:  34%|███▍      | 34/100 [02:27<05:44,  5.22s/it]Evaluating llama-leesplank:  35%|███▌      | 35/100 [02:36<07:03,  6.51s/it]Evaluating llama-leesplank:  36%|███▌      | 36/100 [02:40<06:06,  5.73s/it]Evaluating llama-leesplank:  37%|███▋      | 37/100 [02:47<06:24,  6.11s/it]Evaluating llama-leesplank:  38%|███▊      | 38/100 [02:50<05:17,  5.13s/it]Evaluating llama-leesplank:  39%|███▉      | 39/100 [02:52<04:07,  4.06s/it]Evaluating llama-leesplank:  40%|████      | 40/100 [02:57<04:31,  4.52s/it]Evaluating llama-leesplank:  41%|████      | 41/100 [02:58<03:15,  3.32s/it]Evaluating llama-leesplank:  42%|████▏     | 42/100 [03:00<02:49,  2.93s/it]Evaluating llama-leesplank:  43%|████▎     | 43/100 [03:05<03:25,  3.61s/it]Evaluating llama-leesplank:  44%|████▍     | 44/100 [03:08<03:05,  3.31s/it]Evaluating llama-leesplank:  45%|████▌     | 45/100 [03:12<03:15,  3.55s/it]Evaluating llama-leesplank:  46%|████▌     | 46/100 [03:14<02:43,  3.03s/it]Evaluating llama-leesplank:  47%|████▋     | 47/100 [03:23<04:16,  4.84s/it]Evaluating llama-leesplank:  48%|████▊     | 48/100 [03:28<04:10,  4.83s/it]Evaluating llama-leesplank:  49%|████▉     | 49/100 [03:29<03:15,  3.83s/it]Evaluating llama-leesplank:  50%|█████     | 50/100 [03:33<03:08,  3.77s/it]Evaluating llama-leesplank:  51%|█████     | 51/100 [03:37<03:13,  3.94s/it]Evaluating llama-leesplank:  52%|█████▏    | 52/100 [03:44<03:48,  4.77s/it]Evaluating llama-leesplank:  53%|█████▎    | 53/100 [03:49<03:49,  4.89s/it]Evaluating llama-leesplank:  54%|█████▍    | 54/100 [03:50<02:55,  3.81s/it]Evaluating llama-leesplank:  55%|█████▌    | 55/100 [03:58<03:44,  4.98s/it]Evaluating llama-leesplank:  56%|█████▌    | 56/100 [04:00<03:01,  4.13s/it]Evaluating llama-leesplank:  57%|█████▋    | 57/100 [04:06<03:21,  4.69s/it]Evaluating llama-leesplank:  58%|█████▊    | 58/100 [04:10<03:09,  4.50s/it]Evaluating llama-leesplank:  59%|█████▉    | 59/100 [04:13<02:39,  3.89s/it]Evaluating llama-leesplank:  60%|██████    | 60/100 [04:16<02:27,  3.70s/it]Evaluating llama-leesplank:  61%|██████    | 61/100 [04:20<02:26,  3.74s/it]Evaluating llama-leesplank:  62%|██████▏   | 62/100 [04:24<02:34,  4.07s/it]Evaluating llama-leesplank:  63%|██████▎   | 63/100 [04:28<02:27,  3.98s/it]Evaluating llama-leesplank:  64%|██████▍   | 64/100 [04:35<02:53,  4.81s/it]Evaluating llama-leesplank:  65%|██████▌   | 65/100 [04:36<02:05,  3.60s/it]Evaluating llama-leesplank:  66%|██████▌   | 66/100 [04:37<01:37,  2.88s/it]Evaluating llama-leesplank:  67%|██████▋   | 67/100 [04:41<01:46,  3.21s/it]Evaluating llama-leesplank:  68%|██████▊   | 68/100 [04:43<01:31,  2.86s/it]Evaluating llama-leesplank:  69%|██████▉   | 69/100 [04:46<01:33,  3.03s/it]Evaluating llama-leesplank:  70%|███████   | 70/100 [04:50<01:38,  3.29s/it]Evaluating llama-leesplank:  71%|███████   | 71/100 [04:56<01:57,  4.04s/it]Evaluating llama-leesplank:  72%|███████▏  | 72/100 [04:58<01:37,  3.49s/it]Evaluating llama-leesplank:  73%|███████▎  | 73/100 [05:04<01:48,  4.02s/it]Evaluating llama-leesplank:  74%|███████▍  | 74/100 [05:09<01:52,  4.32s/it]Evaluating llama-leesplank:  75%|███████▌  | 75/100 [05:11<01:31,  3.64s/it]Evaluating llama-leesplank:  76%|███████▌  | 76/100 [05:14<01:27,  3.65s/it]Evaluating llama-leesplank:  77%|███████▋  | 77/100 [05:19<01:29,  3.90s/it]Evaluating llama-leesplank:  78%|███████▊  | 78/100 [05:21<01:15,  3.41s/it]Evaluating llama-leesplank:  79%|███████▉  | 79/100 [05:22<00:55,  2.63s/it]Evaluating llama-leesplank:  80%|████████  | 80/100 [05:23<00:41,  2.09s/it]Evaluating llama-leesplank:  81%|████████  | 81/100 [05:24<00:37,  1.95s/it]Evaluating llama-leesplank:  82%|████████▏ | 82/100 [05:27<00:39,  2.17s/it]Evaluating llama-leesplank:  83%|████████▎ | 83/100 [05:33<00:54,  3.19s/it]Evaluating llama-leesplank:  84%|████████▍ | 84/100 [05:40<01:08,  4.31s/it]Evaluating llama-leesplank:  85%|████████▌ | 85/100 [05:41<00:51,  3.44s/it]Evaluating llama-leesplank:  86%|████████▌ | 86/100 [05:44<00:46,  3.30s/it]Evaluating llama-leesplank:  87%|████████▋ | 87/100 [05:47<00:41,  3.22s/it]Evaluating llama-leesplank:  88%|████████▊ | 88/100 [05:51<00:43,  3.59s/it]Evaluating llama-leesplank:  89%|████████▉ | 89/100 [05:55<00:38,  3.51s/it]Evaluating llama-leesplank:  90%|█████████ | 90/100 [05:59<00:36,  3.61s/it]Evaluating llama-leesplank:  91%|█████████ | 91/100 [06:06<00:42,  4.78s/it]Evaluating llama-leesplank:  92%|█████████▏| 92/100 [06:11<00:39,  4.95s/it]Evaluating llama-leesplank:  93%|█████████▎| 93/100 [06:17<00:35,  5.14s/it]Evaluating llama-leesplank:  94%|█████████▍| 94/100 [06:21<00:28,  4.80s/it]Evaluating llama-leesplank:  95%|█████████▌| 95/100 [06:23<00:20,  4.01s/it]Evaluating llama-leesplank:  96%|█████████▌| 96/100 [06:26<00:14,  3.73s/it]Evaluating llama-leesplank:  97%|█████████▋| 97/100 [06:29<00:10,  3.52s/it]Evaluating llama-leesplank:  98%|█████████▊| 98/100 [06:32<00:06,  3.34s/it]Evaluating llama-leesplank:  99%|█████████▉| 99/100 [06:34<00:02,  2.79s/it]2025-11-11 22:41:16 - INFO - Progress: 100/100, Avg SARI: 66.88
Evaluating llama-leesplank: 100%|██████████| 100/100 [06:38<00:00,  3.34s/it]Evaluating llama-leesplank: 100%|██████████| 100/100 [06:38<00:00,  3.99s/it]
2025-11-11 22:41:16 - INFO - Saved detailed results to evaluation_results/model_card_20251111_095937/greedy_speed/sari_benchmark_20251111_223433/llama-leesplank_results.csv
2025-11-11 22:41:16 - INFO - Saved predictions to evaluation_results/model_card_20251111_095937/greedy_speed/sari_benchmark_20251111_223433/llama-leesplank_predictions.jsonl
2025-11-11 22:41:16 - INFO - 
llama-leesplank Results:
2025-11-11 22:41:16 - INFO -   SARI Score: 66.88 ± 11.87
2025-11-11 22:41:16 - INFO -   Median SARI: 67.77
2025-11-11 22:41:16 - INFO -   Range: [41.13, 100.00]
2025-11-11 22:41:16 - INFO -   Generation Speed: 3.982s/sample
2025-11-11 22:41:16 - INFO - 
============================================================
2025-11-11 22:41:16 - INFO - Evaluating: eurollm-leesplank
2025-11-11 22:41:16 - INFO - ============================================================
2025-11-11 22:41:16 - INFO - Loading model: UWV/leesplank-noot-eurollm-1.7b (type: eurollm)
2025-11-11 22:41:18 - INFO - Loading model in BFloat16 (no quantization)...
Device set to use cuda:0
2025-11-11 22:41:19 - INFO - Model loaded successfully: UWV/leesplank-noot-eurollm-1.7b
2025-11-11 22:41:19 - INFO - Processing 100 samples...
Evaluating eurollm-leesplank:   0%|          | 0/100 [00:00<?, ?it/s]The following generation flags are not valid and may be ignored: ['temperature']. Set `TRANSFORMERS_VERBOSITY=info` for more details.
Evaluating eurollm-leesplank:   1%|          | 1/100 [00:04<07:15,  4.40s/it]Evaluating eurollm-leesplank:   2%|▏         | 2/100 [00:06<04:48,  2.94s/it]Evaluating eurollm-leesplank:   3%|▎         | 3/100 [00:07<03:12,  1.99s/it]Evaluating eurollm-leesplank:   4%|▍         | 4/100 [00:11<04:36,  2.88s/it]Evaluating eurollm-leesplank:   5%|▌         | 5/100 [00:14<04:29,  2.84s/it]Evaluating eurollm-leesplank:   6%|▌         | 6/100 [00:18<04:59,  3.19s/it]Evaluating eurollm-leesplank:   7%|▋         | 7/100 [00:19<03:51,  2.49s/it]Evaluating eurollm-leesplank:   8%|▊         | 8/100 [00:20<03:16,  2.14s/it]Evaluating eurollm-leesplank:   9%|▉         | 9/100 [00:22<03:12,  2.11s/it]Evaluating eurollm-leesplank:  10%|█         | 10/100 [00:23<02:50,  1.89s/it]Evaluating eurollm-leesplank:  11%|█         | 11/100 [00:25<02:26,  1.64s/it]Evaluating eurollm-leesplank:  12%|█▏        | 12/100 [00:27<02:35,  1.77s/it]Evaluating eurollm-leesplank:  13%|█▎        | 13/100 [00:29<03:00,  2.08s/it]Evaluating eurollm-leesplank:  14%|█▍        | 14/100 [00:32<03:01,  2.11s/it]Evaluating eurollm-leesplank:  15%|█▌        | 15/100 [00:34<03:00,  2.12s/it]Evaluating eurollm-leesplank:  16%|█▌        | 16/100 [00:36<02:52,  2.05s/it]Evaluating eurollm-leesplank:  17%|█▋        | 17/100 [00:37<02:30,  1.81s/it]Evaluating eurollm-leesplank:  18%|█▊        | 18/100 [00:39<02:44,  2.00s/it]Evaluating eurollm-leesplank:  19%|█▉        | 19/100 [00:45<04:13,  3.13s/it]Evaluating eurollm-leesplank:  20%|██        | 20/100 [00:49<04:19,  3.25s/it]Evaluating eurollm-leesplank:  21%|██        | 21/100 [00:50<03:26,  2.62s/it]Evaluating eurollm-leesplank:  22%|██▏       | 22/100 [00:53<03:28,  2.68s/it]Evaluating eurollm-leesplank:  23%|██▎       | 23/100 [00:55<03:09,  2.46s/it]Evaluating eurollm-leesplank:  24%|██▍       | 24/100 [00:55<02:23,  1.88s/it]Evaluating eurollm-leesplank:  25%|██▌       | 25/100 [00:58<02:42,  2.17s/it]Evaluating eurollm-leesplank:  26%|██▌       | 26/100 [01:00<02:33,  2.08s/it]Evaluating eurollm-leesplank:  27%|██▋       | 27/100 [01:02<02:41,  2.21s/it]Evaluating eurollm-leesplank:  28%|██▊       | 28/100 [01:04<02:22,  1.97s/it]Evaluating eurollm-leesplank:  29%|██▉       | 29/100 [01:07<02:58,  2.51s/it]Evaluating eurollm-leesplank:  30%|███       | 30/100 [01:08<02:15,  1.94s/it]Evaluating eurollm-leesplank:  31%|███       | 31/100 [01:14<03:37,  3.16s/it]Evaluating eurollm-leesplank:  32%|███▏      | 32/100 [01:18<03:46,  3.33s/it]Evaluating eurollm-leesplank:  33%|███▎      | 33/100 [01:20<03:27,  3.10s/it]Evaluating eurollm-leesplank:  34%|███▍      | 34/100 [01:23<03:22,  3.06s/it]Evaluating eurollm-leesplank:  35%|███▌      | 35/100 [01:35<06:06,  5.64s/it]Evaluating eurollm-leesplank:  36%|███▌      | 36/100 [01:36<04:38,  4.35s/it]Evaluating eurollm-leesplank:  37%|███▋      | 37/100 [01:40<04:28,  4.26s/it]Evaluating eurollm-leesplank:  38%|███▊      | 38/100 [01:42<03:33,  3.45s/it]Evaluating eurollm-leesplank:  39%|███▉      | 39/100 [01:44<02:58,  2.93s/it]Evaluating eurollm-leesplank:  40%|████      | 40/100 [01:47<02:56,  2.94s/it]Evaluating eurollm-leesplank:  41%|████      | 41/100 [01:47<02:05,  2.13s/it]Evaluating eurollm-leesplank:  42%|████▏     | 42/100 [01:48<01:49,  1.89s/it]Evaluating eurollm-leesplank:  43%|████▎     | 43/100 [01:51<02:12,  2.32s/it]Evaluating eurollm-leesplank:  44%|████▍     | 44/100 [01:53<01:58,  2.11s/it]Evaluating eurollm-leesplank:  45%|████▌     | 45/100 [01:55<01:47,  1.96s/it]Evaluating eurollm-leesplank:  46%|████▌     | 46/100 [01:56<01:32,  1.72s/it]Evaluating eurollm-leesplank:  47%|████▋     | 47/100 [02:01<02:23,  2.70s/it]Evaluating eurollm-leesplank:  48%|████▊     | 48/100 [02:03<02:14,  2.58s/it]Evaluating eurollm-leesplank:  49%|████▉     | 49/100 [02:04<01:46,  2.09s/it]Evaluating eurollm-leesplank:  50%|█████     | 50/100 [02:06<01:46,  2.12s/it]Evaluating eurollm-leesplank:  51%|█████     | 51/100 [02:09<01:57,  2.40s/it]Evaluating eurollm-leesplank:  52%|█████▏    | 52/100 [02:13<02:09,  2.70s/it]Evaluating eurollm-leesplank:  53%|█████▎    | 53/100 [02:15<01:59,  2.55s/it]Evaluating eurollm-leesplank:  54%|█████▍    | 54/100 [02:16<01:33,  2.03s/it]Evaluating eurollm-leesplank:  55%|█████▌    | 55/100 [02:19<01:48,  2.41s/it]Evaluating eurollm-leesplank:  56%|█████▌    | 56/100 [02:20<01:26,  1.96s/it]Evaluating eurollm-leesplank:  57%|█████▋    | 57/100 [02:23<01:36,  2.24s/it]Evaluating eurollm-leesplank:  58%|█████▊    | 58/100 [02:25<01:32,  2.20s/it]Evaluating eurollm-leesplank:  59%|█████▉    | 59/100 [02:27<01:24,  2.06s/it]Evaluating eurollm-leesplank:  60%|██████    | 60/100 [02:29<01:20,  2.02s/it]Evaluating eurollm-leesplank:  61%|██████    | 61/100 [02:31<01:23,  2.15s/it]Evaluating eurollm-leesplank:  62%|██████▏   | 62/100 [02:33<01:20,  2.13s/it]Evaluating eurollm-leesplank:  63%|██████▎   | 63/100 [02:36<01:21,  2.19s/it]Evaluating eurollm-leesplank:  64%|██████▍   | 64/100 [02:39<01:35,  2.65s/it]Evaluating eurollm-leesplank:  65%|██████▌   | 65/100 [02:40<01:13,  2.09s/it]Evaluating eurollm-leesplank:  66%|██████▌   | 66/100 [02:41<00:59,  1.74s/it]Evaluating eurollm-leesplank:  67%|██████▋   | 67/100 [02:43<00:57,  1.76s/it]Evaluating eurollm-leesplank:  68%|██████▊   | 68/100 [02:44<00:47,  1.50s/it]Evaluating eurollm-leesplank:  69%|██████▉   | 69/100 [02:46<00:55,  1.78s/it]Evaluating eurollm-leesplank:  70%|███████   | 70/100 [02:48<00:54,  1.83s/it]Evaluating eurollm-leesplank:  71%|███████   | 71/100 [02:51<01:04,  2.22s/it]Evaluating eurollm-leesplank:  72%|███████▏  | 72/100 [02:52<00:54,  1.96s/it]Evaluating eurollm-leesplank:  73%|███████▎  | 73/100 [02:56<01:05,  2.42s/it]Evaluating eurollm-leesplank:  74%|███████▍  | 74/100 [02:59<01:03,  2.46s/it]Evaluating eurollm-leesplank:  75%|███████▌  | 75/100 [03:00<00:51,  2.08s/it]Evaluating eurollm-leesplank:  76%|███████▌  | 76/100 [03:02<00:48,  2.02s/it]Evaluating eurollm-leesplank:  77%|███████▋  | 77/100 [03:04<00:52,  2.27s/it]Evaluating eurollm-leesplank:  78%|███████▊  | 78/100 [03:06<00:43,  2.00s/it]Evaluating eurollm-leesplank:  79%|███████▉  | 79/100 [03:06<00:31,  1.52s/it]Evaluating eurollm-leesplank:  80%|████████  | 80/100 [03:07<00:23,  1.17s/it]Evaluating eurollm-leesplank:  81%|████████  | 81/100 [03:08<00:23,  1.23s/it]Evaluating eurollm-leesplank:  82%|████████▏ | 82/100 [03:10<00:25,  1.39s/it]Evaluating eurollm-leesplank:  83%|████████▎ | 83/100 [03:13<00:32,  1.89s/it]Evaluating eurollm-leesplank:  84%|████████▍ | 84/100 [03:17<00:41,  2.59s/it]Evaluating eurollm-leesplank:  85%|████████▌ | 85/100 [03:18<00:30,  2.03s/it]Evaluating eurollm-leesplank:  86%|████████▌ | 86/100 [03:20<00:28,  2.01s/it]Evaluating eurollm-leesplank:  87%|████████▋ | 87/100 [03:22<00:26,  2.01s/it]Evaluating eurollm-leesplank:  88%|████████▊ | 88/100 [03:24<00:24,  2.05s/it]Evaluating eurollm-leesplank:  89%|████████▉ | 89/100 [03:26<00:22,  2.02s/it]Evaluating eurollm-leesplank:  90%|█████████ | 90/100 [03:28<00:22,  2.22s/it]Evaluating eurollm-leesplank:  91%|█████████ | 91/100 [03:32<00:23,  2.56s/it]Evaluating eurollm-leesplank:  92%|█████████▏| 92/100 [03:34<00:20,  2.59s/it]Evaluating eurollm-leesplank:  93%|█████████▎| 93/100 [03:38<00:20,  2.86s/it]Evaluating eurollm-leesplank:  94%|█████████▍| 94/100 [03:40<00:15,  2.51s/it]Evaluating eurollm-leesplank:  95%|█████████▌| 95/100 [03:41<00:10,  2.11s/it]Evaluating eurollm-leesplank:  96%|█████████▌| 96/100 [03:43<00:08,  2.06s/it]Evaluating eurollm-leesplank:  97%|█████████▋| 97/100 [03:45<00:06,  2.07s/it]Evaluating eurollm-leesplank:  98%|█████████▊| 98/100 [03:48<00:04,  2.35s/it]Evaluating eurollm-leesplank:  99%|█████████▉| 99/100 [03:49<00:01,  1.93s/it]2025-11-11 22:45:11 - INFO - Progress: 100/100, Avg SARI: 66.69
Evaluating eurollm-leesplank: 100%|██████████| 100/100 [03:52<00:00,  2.17s/it]Evaluating eurollm-leesplank: 100%|██████████| 100/100 [03:52<00:00,  2.32s/it]
2025-11-11 22:45:11 - INFO - Saved detailed results to evaluation_results/model_card_20251111_095937/greedy_speed/sari_benchmark_20251111_223433/eurollm-leesplank_results.csv
2025-11-11 22:45:11 - INFO - Saved predictions to evaluation_results/model_card_20251111_095937/greedy_speed/sari_benchmark_20251111_223433/eurollm-leesplank_predictions.jsonl
2025-11-11 22:45:11 - INFO - 
eurollm-leesplank Results:
2025-11-11 22:45:11 - INFO -   SARI Score: 66.69 ± 11.48
2025-11-11 22:45:11 - INFO -   Median SARI: 66.92
2025-11-11 22:45:11 - INFO -   Range: [42.64, 100.00]
2025-11-11 22:45:11 - INFO -   Generation Speed: 2.315s/sample
2025-11-11 22:45:11 - INFO - 
============================================================
2025-11-11 22:45:11 - INFO - Evaluating: granite-leesplank
2025-11-11 22:45:11 - INFO - ============================================================
2025-11-11 22:45:11 - INFO - Loading model: UWV/leesplank-noot-granite-3.3-2b (type: granite)
2025-11-11 22:45:11 - INFO - Loading model in BFloat16 (no quantization)...
Loading checkpoint shards:   0%|          | 0/2 [00:00<?, ?it/s]Loading checkpoint shards:  50%|█████     | 1/2 [00:00<00:00,  1.33it/s]Loading checkpoint shards: 100%|██████████| 2/2 [00:00<00:00,  2.62it/s]
Device set to use cuda:0
2025-11-11 22:45:12 - INFO - Model loaded successfully: UWV/leesplank-noot-granite-3.3-2b
2025-11-11 22:45:12 - INFO - Processing 100 samples...
Evaluating granite-leesplank:   0%|          | 0/100 [00:00<?, ?it/s]Evaluating granite-leesplank:   1%|          | 1/100 [00:09<16:12,  9.82s/it]Evaluating granite-leesplank:   2%|▏         | 2/100 [00:19<15:35,  9.55s/it]Evaluating granite-leesplank:   3%|▎         | 3/100 [00:27<14:52,  9.20s/it]Evaluating granite-leesplank:   4%|▍         | 4/100 [00:38<15:18,  9.57s/it]Evaluating granite-leesplank:   5%|▌         | 5/100 [00:43<13:01,  8.23s/it]Evaluating granite-leesplank:   6%|▌         | 6/100 [00:51<12:40,  8.09s/it]Evaluating granite-leesplank:   7%|▋         | 7/100 [01:00<12:56,  8.35s/it]Evaluating granite-leesplank:   8%|▊         | 8/100 [01:08<12:38,  8.24s/it]Evaluating granite-leesplank:   9%|▉         | 9/100 [01:12<10:17,  6.78s/it]Evaluating granite-leesplank:  10%|█         | 10/100 [01:14<07:58,  5.32s/it]Evaluating granite-leesplank:  11%|█         | 11/100 [01:17<07:02,  4.75s/it]Evaluating granite-leesplank:  12%|█▏        | 12/100 [01:25<08:22,  5.72s/it]Evaluating granite-leesplank:  13%|█▎        | 13/100 [01:35<09:56,  6.86s/it]Evaluating granite-leesplank:  14%|█▍        | 14/100 [01:43<10:36,  7.40s/it]Evaluating granite-leesplank:  15%|█▌        | 15/100 [01:47<08:59,  6.34s/it]Evaluating granite-leesplank:  16%|█▌        | 16/100 [01:52<08:02,  5.74s/it]Evaluating granite-leesplank:  17%|█▋        | 17/100 [02:00<09:11,  6.65s/it]Evaluating granite-leesplank:  18%|█▊        | 18/100 [02:07<08:58,  6.57s/it]Evaluating granite-leesplank:  19%|█▉        | 19/100 [02:17<10:25,  7.72s/it]Evaluating granite-leesplank:  20%|██        | 20/100 [02:26<10:44,  8.06s/it]Evaluating granite-leesplank:  21%|██        | 21/100 [02:30<09:08,  6.95s/it]Evaluating granite-leesplank:  22%|██▏       | 22/100 [02:39<09:42,  7.46s/it]Evaluating granite-leesplank:  23%|██▎       | 23/100 [02:46<09:25,  7.34s/it]Evaluating granite-leesplank:  24%|██▍       | 24/100 [02:47<06:57,  5.49s/it]Evaluating granite-leesplank:  25%|██▌       | 25/100 [02:55<07:44,  6.19s/it]Evaluating granite-leesplank:  26%|██▌       | 26/100 [03:02<08:04,  6.55s/it]Evaluating granite-leesplank:  27%|██▋       | 27/100 [03:13<09:31,  7.82s/it]Evaluating granite-leesplank:  28%|██▊       | 28/100 [03:20<08:52,  7.39s/it]Evaluating granite-leesplank:  29%|██▉       | 29/100 [03:26<08:31,  7.21s/it]Evaluating granite-leesplank:  30%|███       | 30/100 [03:33<08:04,  6.93s/it]Evaluating granite-leesplank:  31%|███       | 31/100 [03:47<10:22,  9.02s/it]Evaluating granite-leesplank:  32%|███▏      | 32/100 [03:54<09:47,  8.64s/it]Evaluating granite-leesplank:  33%|███▎      | 33/100 [04:02<09:27,  8.47s/it]Evaluating granite-leesplank:  34%|███▍      | 34/100 [04:14<10:19,  9.38s/it]Evaluating granite-leesplank:  35%|███▌      | 35/100 [04:23<10:08,  9.36s/it]Evaluating granite-leesplank:  36%|███▌      | 36/100 [04:31<09:34,  8.98s/it]Evaluating granite-leesplank:  37%|███▋      | 37/100 [04:42<09:50,  9.37s/it]Evaluating granite-leesplank:  38%|███▊      | 38/100 [04:48<08:39,  8.39s/it]Evaluating granite-leesplank:  39%|███▉      | 39/100 [04:57<08:54,  8.77s/it]Evaluating granite-leesplank:  40%|████      | 40/100 [05:06<08:52,  8.88s/it]Evaluating granite-leesplank:  41%|████      | 41/100 [05:07<06:18,  6.41s/it]Evaluating granite-leesplank:  42%|████▏     | 42/100 [05:14<06:22,  6.60s/it]Evaluating granite-leesplank:  43%|████▎     | 43/100 [05:20<06:09,  6.48s/it]Evaluating granite-leesplank:  44%|████▍     | 44/100 [05:34<07:58,  8.55s/it]Evaluating granite-leesplank:  45%|████▌     | 45/100 [05:39<06:51,  7.49s/it]Evaluating granite-leesplank:  46%|████▌     | 46/100 [05:49<07:27,  8.29s/it]Evaluating granite-leesplank:  47%|████▋     | 47/100 [06:02<08:39,  9.81s/it]Evaluating granite-leesplank:  48%|████▊     | 48/100 [06:08<07:22,  8.50s/it]Evaluating granite-leesplank:  49%|████▉     | 49/100 [06:15<06:53,  8.10s/it]Evaluating granite-leesplank:  50%|█████     | 50/100 [06:23<06:38,  7.97s/it]Evaluating granite-leesplank:  51%|█████     | 51/100 [06:27<05:45,  7.05s/it]Evaluating granite-leesplank:  52%|█████▏    | 52/100 [06:35<05:40,  7.10s/it]Evaluating granite-leesplank:  53%|█████▎    | 53/100 [06:41<05:23,  6.88s/it]Evaluating granite-leesplank:  54%|█████▍    | 54/100 [06:43<04:06,  5.35s/it]Evaluating granite-leesplank:  55%|█████▌    | 55/100 [06:54<05:16,  7.03s/it]Evaluating granite-leesplank:  56%|█████▌    | 56/100 [07:00<04:54,  6.69s/it]Evaluating granite-leesplank:  57%|█████▋    | 57/100 [07:06<04:45,  6.64s/it]Evaluating granite-leesplank:  58%|█████▊    | 58/100 [07:12<04:31,  6.46s/it]Evaluating granite-leesplank:  59%|█████▉    | 59/100 [07:20<04:41,  6.88s/it]Evaluating granite-leesplank:  60%|██████    | 60/100 [07:26<04:19,  6.48s/it]Evaluating granite-leesplank:  61%|██████    | 61/100 [07:31<03:56,  6.07s/it]Evaluating granite-leesplank:  62%|██████▏   | 62/100 [07:36<03:36,  5.69s/it]Evaluating granite-leesplank:  63%|██████▎   | 63/100 [07:42<03:35,  5.83s/it]Evaluating granite-leesplank:  64%|██████▍   | 64/100 [07:49<03:46,  6.28s/it]Evaluating granite-leesplank:  65%|██████▌   | 65/100 [07:52<03:03,  5.25s/it]Evaluating granite-leesplank:  66%|██████▌   | 66/100 [07:57<02:58,  5.26s/it]Evaluating granite-leesplank:  67%|██████▋   | 67/100 [08:03<03:04,  5.59s/it]Evaluating granite-leesplank:  68%|██████▊   | 68/100 [08:13<03:36,  6.76s/it]Evaluating granite-leesplank:  69%|██████▉   | 69/100 [08:18<03:15,  6.32s/it]Evaluating granite-leesplank:  70%|███████   | 70/100 [08:26<03:24,  6.80s/it]Evaluating granite-leesplank:  71%|███████   | 71/100 [08:32<03:07,  6.48s/it]Evaluating granite-leesplank:  72%|███████▏  | 72/100 [08:40<03:13,  6.92s/it]Evaluating granite-leesplank:  73%|███████▎  | 73/100 [08:48<03:12,  7.15s/it]Evaluating granite-leesplank:  74%|███████▍  | 74/100 [08:54<02:56,  6.79s/it]Evaluating granite-leesplank:  75%|███████▌  | 75/100 [09:02<03:02,  7.29s/it]Evaluating granite-leesplank:  76%|███████▌  | 76/100 [09:12<03:16,  8.18s/it]Evaluating granite-leesplank:  77%|███████▋  | 77/100 [09:18<02:50,  7.40s/it]Evaluating granite-leesplank:  78%|███████▊  | 78/100 [09:21<02:15,  6.18s/it]Evaluating granite-leesplank:  79%|███████▉  | 79/100 [09:22<01:36,  4.58s/it]Evaluating granite-leesplank:  80%|████████  | 80/100 [09:23<01:10,  3.55s/it]Evaluating granite-leesplank:  81%|████████  | 81/100 [09:31<01:32,  4.86s/it]Evaluating granite-leesplank:  82%|████████▏ | 82/100 [09:40<01:49,  6.10s/it]Evaluating granite-leesplank:  83%|████████▎ | 83/100 [09:47<01:49,  6.45s/it]Evaluating granite-leesplank:  84%|████████▍ | 84/100 [09:53<01:40,  6.29s/it]Evaluating granite-leesplank:  85%|████████▌ | 85/100 [10:03<01:51,  7.42s/it]Evaluating granite-leesplank:  86%|████████▌ | 86/100 [10:10<01:41,  7.24s/it]Evaluating granite-leesplank:  87%|████████▋ | 87/100 [10:19<01:40,  7.74s/it]Evaluating granite-leesplank:  88%|████████▊ | 88/100 [10:24<01:24,  7.03s/it]Evaluating granite-leesplank:  89%|████████▉ | 89/100 [10:29<01:09,  6.34s/it]Evaluating granite-leesplank:  90%|█████████ | 90/100 [10:35<01:00,  6.07s/it]Evaluating granite-leesplank:  91%|█████████ | 91/100 [10:43<00:59,  6.66s/it]Evaluating granite-leesplank:  92%|█████████▏| 92/100 [10:48<00:50,  6.28s/it]Evaluating granite-leesplank:  93%|█████████▎| 93/100 [11:00<00:55,  7.93s/it]Evaluating granite-leesplank:  94%|█████████▍| 94/100 [11:04<00:40,  6.68s/it]Evaluating granite-leesplank:  95%|█████████▌| 95/100 [11:11<00:34,  6.82s/it]Evaluating granite-leesplank:  96%|█████████▌| 96/100 [11:20<00:30,  7.66s/it]Evaluating granite-leesplank:  97%|█████████▋| 97/100 [11:29<00:24,  8.02s/it]Evaluating granite-leesplank:  98%|█████████▊| 98/100 [11:35<00:14,  7.37s/it]Evaluating granite-leesplank:  99%|█████████▉| 99/100 [11:44<00:07,  7.89s/it]2025-11-11 22:57:05 - INFO - Progress: 100/100, Avg SARI: 64.87
Evaluating granite-leesplank: 100%|██████████| 100/100 [11:52<00:00,  7.79s/it]Evaluating granite-leesplank: 100%|██████████| 100/100 [11:52<00:00,  7.12s/it]
2025-11-11 22:57:05 - INFO - Saved detailed results to evaluation_results/model_card_20251111_095937/greedy_speed/sari_benchmark_20251111_223433/granite-leesplank_results.csv
2025-11-11 22:57:05 - INFO - Saved predictions to evaluation_results/model_card_20251111_095937/greedy_speed/sari_benchmark_20251111_223433/granite-leesplank_predictions.jsonl
2025-11-11 22:57:05 - INFO - 
granite-leesplank Results:
2025-11-11 22:57:05 - INFO -   SARI Score: 64.87 ± 12.06
2025-11-11 22:57:05 - INFO -   Median SARI: 66.66
2025-11-11 22:57:05 - INFO -   Range: [36.12, 100.00]
2025-11-11 22:57:05 - INFO -   Generation Speed: 7.116s/sample
2025-11-11 22:57:05 - INFO - 
============================================================
2025-11-11 22:57:05 - INFO - COMPARATIVE ANALYSIS
2025-11-11 22:57:05 - INFO - ============================================================
2025-11-11 22:57:05 - INFO - 
SARI Score Comparison:
2025-11-11 22:57:05 - INFO -   llama-leesplank               :  66.88 ±  11.87
2025-11-11 22:57:05 - INFO -   eurollm-leesplank             :  66.69 ±  11.48
2025-11-11 22:57:05 - INFO -   granite-leesplank             :  64.87 ±  12.06
2025-11-11 22:57:05 - INFO - 
Best performing model: llama-leesplank (SARI: 66.88)
2025-11-11 22:57:05 - INFO - 
Performance difference: 0.20 SARI points
2025-11-11 22:57:05 - INFO - Approximate t-statistic: 0.120
2025-11-11 22:57:05 - INFO - Difference may not be statistically significant
2025-11-11 22:57:05 - INFO - 
Generation Speed Comparison:
2025-11-11 22:57:05 - INFO -   llama-leesplank               :  3.982s/sample
2025-11-11 22:57:05 - INFO -   eurollm-leesplank             :  2.315s/sample
2025-11-11 22:57:05 - INFO -   granite-leesplank             :  7.116s/sample
2025-11-11 22:57:05 - INFO - 
Comparative analysis saved to evaluation_results/model_card_20251111_095937/greedy_speed/sari_benchmark_20251111_223433/comparative_analysis.json
2025-11-11 22:57:05 - INFO - Results saved to evaluation_results/model_card_20251111_095937/greedy_speed/sari_benchmark_20251111_223433
2025-11-11 22:57:05 - INFO - 
Evaluation complete! Results saved to evaluation_results/model_card_20251111_095937/greedy_speed/sari_benchmark_20251111_223433
