2025-11-10 00:54:19 - INFO - Using device: cuda
2025-11-10 00:54:19 - INFO - GPU: NVIDIA GeForce RTX 3090 (23.7 GB)
2025-11-10 00:54:20 - INFO - Starting Comprehensive SARI Benchmark Evaluation
2025-11-10 00:54:20 - INFO - Output directory: evaluation_results/model_card_20251109_151419/greedy_speed/sari_benchmark_20251110_005420
2025-11-10 00:54:20 - INFO - Loading test dataset...
2025-11-10 00:54:22 - INFO - Dataset loaded: 268783 total samples
2025-11-10 00:54:22 - INFO - Will evaluate on 100 samples
2025-11-10 00:54:22 - INFO - 
============================================================
2025-11-10 00:54:22 - INFO - Evaluating: eurollm-leesplank
2025-11-10 00:54:22 - INFO - ============================================================
2025-11-10 00:54:22 - INFO - Loading model: UWV/leesplank-noot-eurollm-1.7b (type: eurollm)
2025-11-10 00:54:23 - INFO - Loading model in BFloat16 (no quantization)...
`torch_dtype` is deprecated! Use `dtype` instead!
Device set to use cuda:0
2025-11-10 00:54:25 - INFO - Model loaded successfully: UWV/leesplank-noot-eurollm-1.7b
2025-11-10 00:54:25 - INFO - Processing 100 samples...
Evaluating eurollm-leesplank:   0%|          | 0/100 [00:00<?, ?it/s]The following generation flags are not valid and may be ignored: ['temperature']. Set `TRANSFORMERS_VERBOSITY=info` for more details.
Evaluating eurollm-leesplank:   1%|          | 1/100 [00:06<10:07,  6.13s/it]Evaluating eurollm-leesplank:   2%|▏         | 2/100 [00:08<06:28,  3.96s/it]Evaluating eurollm-leesplank:   3%|▎         | 3/100 [00:09<04:16,  2.64s/it]Evaluating eurollm-leesplank:   4%|▍         | 4/100 [00:15<05:57,  3.72s/it]Evaluating eurollm-leesplank:   5%|▌         | 5/100 [00:18<05:45,  3.64s/it]Evaluating eurollm-leesplank:   6%|▌         | 6/100 [00:23<06:22,  4.07s/it]Evaluating eurollm-leesplank:   7%|▋         | 7/100 [00:24<04:55,  3.17s/it]Evaluating eurollm-leesplank:   8%|▊         | 8/100 [00:26<04:09,  2.71s/it]Evaluating eurollm-leesplank:   9%|▉         | 9/100 [00:29<04:04,  2.68s/it]Evaluating eurollm-leesplank:  10%|█         | 10/100 [00:30<03:36,  2.40s/it]You seem to be using the pipelines sequentially on GPU. In order to maximize efficiency please use a dataset
Evaluating eurollm-leesplank:  11%|█         | 11/100 [00:32<03:05,  2.08s/it]Evaluating eurollm-leesplank:  12%|█▏        | 12/100 [00:34<03:17,  2.24s/it]Evaluating eurollm-leesplank:  13%|█▎        | 13/100 [00:38<03:46,  2.60s/it]Evaluating eurollm-leesplank:  14%|█▍        | 14/100 [00:41<03:48,  2.66s/it]Evaluating eurollm-leesplank:  15%|█▌        | 15/100 [00:43<03:47,  2.67s/it]Evaluating eurollm-leesplank:  16%|█▌        | 16/100 [00:46<03:37,  2.59s/it]Evaluating eurollm-leesplank:  17%|█▋        | 17/100 [00:47<03:09,  2.29s/it]Evaluating eurollm-leesplank:  18%|█▊        | 18/100 [00:50<03:28,  2.54s/it]Evaluating eurollm-leesplank:  19%|█▉        | 19/100 [00:58<05:21,  3.97s/it]Evaluating eurollm-leesplank:  20%|██        | 20/100 [01:02<05:29,  4.11s/it]Evaluating eurollm-leesplank:  21%|██        | 21/100 [01:04<04:21,  3.31s/it]Evaluating eurollm-leesplank:  22%|██▏       | 22/100 [01:07<04:24,  3.39s/it]Evaluating eurollm-leesplank:  23%|██▎       | 23/100 [01:10<04:00,  3.12s/it]Evaluating eurollm-leesplank:  24%|██▍       | 24/100 [01:10<03:01,  2.38s/it]Evaluating eurollm-leesplank:  25%|██▌       | 25/100 [01:14<03:26,  2.75s/it]Evaluating eurollm-leesplank:  26%|██▌       | 26/100 [01:16<03:14,  2.63s/it]Evaluating eurollm-leesplank:  27%|██▋       | 27/100 [01:19<03:24,  2.80s/it]Evaluating eurollm-leesplank:  28%|██▊       | 28/100 [01:21<03:00,  2.50s/it]Evaluating eurollm-leesplank:  29%|██▉       | 29/100 [01:26<03:45,  3.18s/it]Evaluating eurollm-leesplank:  30%|███       | 30/100 [01:27<02:51,  2.46s/it]Evaluating eurollm-leesplank:  31%|███       | 31/100 [01:34<04:35,  3.99s/it]Evaluating eurollm-leesplank:  32%|███▏      | 32/100 [01:39<04:45,  4.20s/it]Evaluating eurollm-leesplank:  33%|███▎      | 33/100 [01:42<04:22,  3.92s/it]Evaluating eurollm-leesplank:  34%|███▍      | 34/100 [01:46<04:15,  3.87s/it]Evaluating eurollm-leesplank:  35%|███▌      | 35/100 [02:01<07:44,  7.14s/it]Evaluating eurollm-leesplank:  36%|███▌      | 36/100 [02:03<05:52,  5.50s/it]Evaluating eurollm-leesplank:  37%|███▋      | 37/100 [02:08<05:39,  5.38s/it]Evaluating eurollm-leesplank:  38%|███▊      | 38/100 [02:10<04:29,  4.35s/it]Evaluating eurollm-leesplank:  39%|███▉      | 39/100 [02:12<03:45,  3.69s/it]Evaluating eurollm-leesplank:  40%|████      | 40/100 [02:15<03:42,  3.71s/it]Evaluating eurollm-leesplank:  41%|████      | 41/100 [02:16<02:38,  2.69s/it]Evaluating eurollm-leesplank:  42%|████▏     | 42/100 [02:17<02:18,  2.38s/it]Evaluating eurollm-leesplank:  43%|████▎     | 43/100 [02:22<02:46,  2.93s/it]Evaluating eurollm-leesplank:  44%|████▍     | 44/100 [02:24<02:29,  2.66s/it]Evaluating eurollm-leesplank:  45%|████▌     | 45/100 [02:26<02:15,  2.46s/it]Evaluating eurollm-leesplank:  46%|████▌     | 46/100 [02:27<01:56,  2.16s/it]Evaluating eurollm-leesplank:  47%|████▋     | 47/100 [02:33<03:00,  3.41s/it]Evaluating eurollm-leesplank:  48%|████▊     | 48/100 [02:36<02:49,  3.26s/it]Evaluating eurollm-leesplank:  49%|████▉     | 49/100 [02:38<02:14,  2.63s/it]Evaluating eurollm-leesplank:  50%|█████     | 50/100 [02:40<02:13,  2.68s/it]Evaluating eurollm-leesplank:  51%|█████     | 51/100 [02:44<02:27,  3.00s/it]Evaluating eurollm-leesplank:  52%|█████▏    | 52/100 [02:48<02:43,  3.40s/it]Evaluating eurollm-leesplank:  53%|█████▎    | 53/100 [02:51<02:30,  3.21s/it]Evaluating eurollm-leesplank:  54%|█████▍    | 54/100 [02:52<01:57,  2.56s/it]Evaluating eurollm-leesplank:  55%|█████▌    | 55/100 [02:56<02:17,  3.05s/it]Evaluating eurollm-leesplank:  56%|█████▌    | 56/100 [02:58<01:49,  2.48s/it]Evaluating eurollm-leesplank:  57%|█████▋    | 57/100 [03:01<02:01,  2.83s/it]Evaluating eurollm-leesplank:  58%|█████▊    | 58/100 [03:04<01:57,  2.79s/it]Evaluating eurollm-leesplank:  59%|█████▉    | 59/100 [03:06<01:46,  2.61s/it]Evaluating eurollm-leesplank:  60%|██████    | 60/100 [03:09<01:42,  2.55s/it]Evaluating eurollm-leesplank:  61%|██████    | 61/100 [03:12<01:46,  2.73s/it]Evaluating eurollm-leesplank:  62%|██████▏   | 62/100 [03:14<01:42,  2.69s/it]Evaluating eurollm-leesplank:  63%|██████▎   | 63/100 [03:17<01:42,  2.78s/it]Evaluating eurollm-leesplank:  64%|██████▍   | 64/100 [03:22<02:00,  3.35s/it]Evaluating eurollm-leesplank:  65%|██████▌   | 65/100 [03:23<01:32,  2.64s/it]Evaluating eurollm-leesplank:  66%|██████▌   | 66/100 [03:24<01:14,  2.20s/it]Evaluating eurollm-leesplank:  67%|██████▋   | 67/100 [03:26<01:13,  2.22s/it]Evaluating eurollm-leesplank:  68%|██████▊   | 68/100 [03:28<01:00,  1.90s/it]Evaluating eurollm-leesplank:  69%|██████▉   | 69/100 [03:31<01:10,  2.26s/it]Evaluating eurollm-leesplank:  70%|███████   | 70/100 [03:33<01:09,  2.32s/it]Evaluating eurollm-leesplank:  71%|███████   | 71/100 [03:37<01:21,  2.81s/it]Evaluating eurollm-leesplank:  72%|███████▏  | 72/100 [03:39<01:09,  2.48s/it]Evaluating eurollm-leesplank:  73%|███████▎  | 73/100 [03:43<01:22,  3.07s/it]Evaluating eurollm-leesplank:  74%|███████▍  | 74/100 [03:46<01:21,  3.12s/it]Evaluating eurollm-leesplank:  75%|███████▌  | 75/100 [03:48<01:05,  2.64s/it]Evaluating eurollm-leesplank:  76%|███████▌  | 76/100 [03:50<01:01,  2.57s/it]Evaluating eurollm-leesplank:  77%|███████▋  | 77/100 [03:54<01:06,  2.88s/it]Evaluating eurollm-leesplank:  78%|███████▊  | 78/100 [03:56<00:55,  2.54s/it]Evaluating eurollm-leesplank:  79%|███████▉  | 79/100 [03:56<00:40,  1.93s/it]Evaluating eurollm-leesplank:  80%|████████  | 80/100 [03:57<00:29,  1.49s/it]Evaluating eurollm-leesplank:  81%|████████  | 81/100 [03:58<00:29,  1.55s/it]Evaluating eurollm-leesplank:  82%|████████▏ | 82/100 [04:01<00:31,  1.76s/it]Evaluating eurollm-leesplank:  83%|████████▎ | 83/100 [04:04<00:40,  2.39s/it]Evaluating eurollm-leesplank:  84%|████████▍ | 84/100 [04:10<00:52,  3.27s/it]Evaluating eurollm-leesplank:  85%|████████▌ | 85/100 [04:11<00:38,  2.56s/it]Evaluating eurollm-leesplank:  86%|████████▌ | 86/100 [04:13<00:35,  2.53s/it]Evaluating eurollm-leesplank:  87%|████████▋ | 87/100 [04:16<00:33,  2.54s/it]Evaluating eurollm-leesplank:  88%|████████▊ | 88/100 [04:18<00:31,  2.58s/it]Evaluating eurollm-leesplank:  89%|████████▉ | 89/100 [04:21<00:28,  2.55s/it]Evaluating eurollm-leesplank:  90%|█████████ | 90/100 [04:24<00:28,  2.81s/it]Evaluating eurollm-leesplank:  91%|█████████ | 91/100 [04:29<00:29,  3.23s/it]Evaluating eurollm-leesplank:  92%|█████████▏| 92/100 [04:32<00:26,  3.27s/it]Evaluating eurollm-leesplank:  93%|█████████▎| 93/100 [04:36<00:25,  3.63s/it]Evaluating eurollm-leesplank:  94%|█████████▍| 94/100 [04:38<00:19,  3.17s/it]Evaluating eurollm-leesplank:  95%|█████████▌| 95/100 [04:40<00:13,  2.67s/it]Evaluating eurollm-leesplank:  96%|█████████▌| 96/100 [04:42<00:10,  2.60s/it]Evaluating eurollm-leesplank:  97%|█████████▋| 97/100 [04:45<00:07,  2.61s/it]Evaluating eurollm-leesplank:  98%|█████████▊| 98/100 [04:49<00:05,  2.94s/it]Evaluating eurollm-leesplank:  99%|█████████▉| 99/100 [04:50<00:02,  2.42s/it]2025-11-10 00:59:18 - INFO - Progress: 100/100, Avg SARI: 66.69
Evaluating eurollm-leesplank: 100%|██████████| 100/100 [04:53<00:00,  2.73s/it]Evaluating eurollm-leesplank: 100%|██████████| 100/100 [04:53<00:00,  2.94s/it]
2025-11-10 00:59:18 - INFO - Saved detailed results to evaluation_results/model_card_20251109_151419/greedy_speed/sari_benchmark_20251110_005420/eurollm-leesplank_results.csv
2025-11-10 00:59:18 - INFO - Saved predictions to evaluation_results/model_card_20251109_151419/greedy_speed/sari_benchmark_20251110_005420/eurollm-leesplank_predictions.jsonl
2025-11-10 00:59:18 - INFO - 
eurollm-leesplank Results:
2025-11-10 00:59:18 - INFO -   SARI Score: 66.69 ± 11.48
2025-11-10 00:59:18 - INFO -   Median SARI: 66.92
2025-11-10 00:59:18 - INFO -   Range: [42.64, 100.00]
2025-11-10 00:59:18 - INFO -   Generation Speed: 2.933s/sample
2025-11-10 00:59:18 - INFO - 
============================================================
2025-11-10 00:59:18 - INFO - Evaluating: granite-leesplank
2025-11-10 00:59:18 - INFO - ============================================================
2025-11-10 00:59:18 - INFO - Loading model: UWV/leesplank-noot-granite-3.3-2b (type: granite)
2025-11-10 00:59:19 - INFO - Loading model in BFloat16 (no quantization)...
Loading checkpoint shards:   0%|          | 0/2 [00:00<?, ?it/s]Loading checkpoint shards:  50%|█████     | 1/2 [00:00<00:00,  1.35it/s]Loading checkpoint shards: 100%|██████████| 2/2 [00:00<00:00,  2.66it/s]
Device set to use cuda:0
2025-11-10 00:59:20 - INFO - Model loaded successfully: UWV/leesplank-noot-granite-3.3-2b
2025-11-10 00:59:20 - INFO - Processing 100 samples...
Evaluating granite-leesplank:   0%|          | 0/100 [00:00<?, ?it/s]Evaluating granite-leesplank:   1%|          | 1/100 [00:12<20:32, 12.45s/it]Evaluating granite-leesplank:   2%|▏         | 2/100 [00:24<19:46, 12.11s/it]Evaluating granite-leesplank:   3%|▎         | 3/100 [00:35<18:53, 11.68s/it]Evaluating granite-leesplank:   4%|▍         | 4/100 [00:48<19:24, 12.13s/it]Evaluating granite-leesplank:   5%|▌         | 5/100 [00:55<16:31, 10.43s/it]Evaluating granite-leesplank:   6%|▌         | 6/100 [01:05<16:03, 10.26s/it]Evaluating granite-leesplank:   7%|▋         | 7/100 [01:16<16:24, 10.59s/it]Evaluating granite-leesplank:   8%|▊         | 8/100 [01:27<16:01, 10.46s/it]Evaluating granite-leesplank:   9%|▉         | 9/100 [01:31<13:03,  8.60s/it]Evaluating granite-leesplank:  10%|█         | 10/100 [01:34<10:07,  6.75s/it]Evaluating granite-leesplank:  11%|█         | 11/100 [01:38<08:56,  6.03s/it]Evaluating granite-leesplank:  12%|█▏        | 12/100 [01:48<10:38,  7.26s/it]Evaluating granite-leesplank:  13%|█▎        | 13/100 [02:00<12:38,  8.72s/it]Evaluating granite-leesplank:  14%|█▍        | 14/100 [02:11<13:28,  9.40s/it]Evaluating granite-leesplank:  15%|█▌        | 15/100 [02:16<11:24,  8.06s/it]Evaluating granite-leesplank:  16%|█▌        | 16/100 [02:22<10:12,  7.29s/it]Evaluating granite-leesplank:  17%|█▋        | 17/100 [02:33<11:41,  8.45s/it]Evaluating granite-leesplank:  18%|█▊        | 18/100 [02:41<11:24,  8.34s/it]Evaluating granite-leesplank:  19%|█▉        | 19/100 [02:54<13:11,  9.77s/it]Evaluating granite-leesplank:  20%|██        | 20/100 [03:05<13:38, 10.23s/it]Evaluating granite-leesplank:  21%|██        | 21/100 [03:11<11:36,  8.82s/it]Evaluating granite-leesplank:  22%|██▏       | 22/100 [03:22<12:18,  9.47s/it]Evaluating granite-leesplank:  23%|██▎       | 23/100 [03:31<11:56,  9.31s/it]Evaluating granite-leesplank:  24%|██▍       | 24/100 [03:32<08:48,  6.96s/it]Evaluating granite-leesplank:  25%|██▌       | 25/100 [03:42<09:48,  7.84s/it]Evaluating granite-leesplank:  26%|██▌       | 26/100 [03:52<10:15,  8.31s/it]Evaluating granite-leesplank:  27%|██▋       | 27/100 [04:05<12:04,  9.92s/it]Evaluating granite-leesplank:  28%|██▊       | 28/100 [04:13<11:14,  9.37s/it]Evaluating granite-leesplank:  29%|██▉       | 29/100 [04:22<10:48,  9.14s/it]Evaluating granite-leesplank:  30%|███       | 30/100 [04:30<10:14,  8.78s/it]Evaluating granite-leesplank:  31%|███       | 31/100 [04:47<13:08, 11.43s/it]Evaluating granite-leesplank:  32%|███▏      | 32/100 [04:57<12:24, 10.95s/it]Evaluating granite-leesplank:  33%|███▎      | 33/100 [05:08<11:59, 10.74s/it]Evaluating granite-leesplank:  34%|███▍      | 34/100 [05:22<13:05, 11.90s/it]Evaluating granite-leesplank:  35%|███▌      | 35/100 [05:34<12:51, 11.87s/it]Evaluating granite-leesplank:  36%|███▌      | 36/100 [05:44<12:09, 11.40s/it]Evaluating granite-leesplank:  37%|███▋      | 37/100 [05:57<12:29, 11.90s/it]Evaluating granite-leesplank:  38%|███▊      | 38/100 [06:05<11:00, 10.66s/it]Evaluating granite-leesplank:  39%|███▉      | 39/100 [06:17<11:18, 11.13s/it]Evaluating granite-leesplank:  40%|████      | 40/100 [06:29<11:17, 11.29s/it]Evaluating granite-leesplank:  41%|████      | 41/100 [06:30<08:00,  8.15s/it]Evaluating granite-leesplank:  42%|████▏     | 42/100 [06:39<08:07,  8.40s/it]Evaluating granite-leesplank:  43%|████▎     | 43/100 [06:47<07:50,  8.25s/it]Evaluating granite-leesplank:  44%|████▍     | 44/100 [07:04<10:11, 10.92s/it]Evaluating granite-leesplank:  45%|████▌     | 45/100 [07:10<08:44,  9.54s/it]Evaluating granite-leesplank:  46%|████▌     | 46/100 [07:23<09:29, 10.55s/it]Evaluating granite-leesplank:  47%|████▋     | 47/100 [07:40<10:59, 12.45s/it]Evaluating granite-leesplank:  48%|████▊     | 48/100 [07:47<09:21, 10.79s/it]Evaluating granite-leesplank:  49%|████▉     | 49/100 [07:56<08:44, 10.29s/it]Evaluating granite-leesplank:  50%|█████     | 50/100 [08:06<08:25, 10.12s/it]Evaluating granite-leesplank:  51%|█████     | 51/100 [08:12<07:18,  8.94s/it]Evaluating granite-leesplank:  52%|█████▏    | 52/100 [08:21<07:12,  9.01s/it]Evaluating granite-leesplank:  53%|█████▎    | 53/100 [08:29<06:50,  8.73s/it]Evaluating granite-leesplank:  54%|█████▍    | 54/100 [08:31<05:12,  6.79s/it]Evaluating granite-leesplank:  55%|█████▌    | 55/100 [08:45<06:41,  8.92s/it]Evaluating granite-leesplank:  56%|█████▌    | 56/100 [08:53<06:13,  8.49s/it]Evaluating granite-leesplank:  57%|█████▋    | 57/100 [09:01<06:02,  8.44s/it]Evaluating granite-leesplank:  58%|█████▊    | 58/100 [09:09<05:44,  8.21s/it]Evaluating granite-leesplank:  59%|█████▉    | 59/100 [09:19<05:58,  8.74s/it]Evaluating granite-leesplank:  60%|██████    | 60/100 [09:26<05:28,  8.20s/it]Evaluating granite-leesplank:  61%|██████    | 61/100 [09:32<05:00,  7.70s/it]Evaluating granite-leesplank:  62%|██████▏   | 62/100 [09:38<04:34,  7.22s/it]Evaluating granite-leesplank:  63%|██████▎   | 63/100 [09:46<04:34,  7.41s/it]Evaluating granite-leesplank:  64%|██████▍   | 64/100 [09:56<04:47,  7.99s/it]Evaluating granite-leesplank:  65%|██████▌   | 65/100 [09:59<03:53,  6.68s/it]Evaluating granite-leesplank:  66%|██████▌   | 66/100 [10:06<03:47,  6.69s/it]Evaluating granite-leesplank:  67%|██████▋   | 67/100 [10:14<03:54,  7.11s/it]Evaluating granite-leesplank:  68%|██████▊   | 68/100 [10:26<04:35,  8.61s/it]Evaluating granite-leesplank:  69%|██████▉   | 69/100 [10:33<04:09,  8.04s/it]Evaluating granite-leesplank:  70%|███████   | 70/100 [10:43<04:19,  8.66s/it]Evaluating granite-leesplank:  71%|███████   | 71/100 [10:50<03:58,  8.24s/it]Evaluating granite-leesplank:  72%|███████▏  | 72/100 [11:00<04:07,  8.84s/it]Evaluating granite-leesplank:  73%|███████▎  | 73/100 [11:10<04:05,  9.09s/it]Evaluating granite-leesplank:  74%|███████▍  | 74/100 [11:18<03:44,  8.63s/it]Evaluating granite-leesplank:  75%|███████▌  | 75/100 [11:28<03:51,  9.26s/it]Evaluating granite-leesplank:  76%|███████▌  | 76/100 [11:41<04:09, 10.38s/it]Evaluating granite-leesplank:  77%|███████▋  | 77/100 [11:48<03:35,  9.39s/it]Evaluating granite-leesplank:  78%|███████▊  | 78/100 [11:53<02:52,  7.84s/it]Evaluating granite-leesplank:  79%|███████▉  | 79/100 [11:54<02:01,  5.81s/it]Evaluating granite-leesplank:  80%|████████  | 80/100 [11:55<01:29,  4.50s/it]Evaluating granite-leesplank:  81%|████████  | 81/100 [12:05<01:57,  6.17s/it]Evaluating granite-leesplank:  82%|████████▏ | 82/100 [12:17<02:19,  7.75s/it]Evaluating granite-leesplank:  83%|████████▎ | 83/100 [12:26<02:19,  8.19s/it]Evaluating granite-leesplank:  84%|████████▍ | 84/100 [12:33<02:07,  7.98s/it]Evaluating granite-leesplank:  85%|████████▌ | 85/100 [12:46<02:20,  9.39s/it]Evaluating granite-leesplank:  86%|████████▌ | 86/100 [12:55<02:08,  9.18s/it]Evaluating granite-leesplank:  87%|████████▋ | 87/100 [13:06<02:07,  9.84s/it]Evaluating granite-leesplank:  88%|████████▊ | 88/100 [13:13<01:47,  8.93s/it]Evaluating granite-leesplank:  89%|████████▉ | 89/100 [13:19<01:28,  8.06s/it]Evaluating granite-leesplank:  90%|█████████ | 90/100 [13:26<01:17,  7.72s/it]Evaluating granite-leesplank:  91%|█████████ | 91/100 [13:36<01:16,  8.47s/it]Evaluating granite-leesplank:  92%|█████████▏| 92/100 [13:43<01:03,  8.00s/it]Evaluating granite-leesplank:  93%|█████████▎| 93/100 [13:58<01:10, 10.09s/it]Evaluating granite-leesplank:  94%|█████████▍| 94/100 [14:03<00:51,  8.51s/it]Evaluating granite-leesplank:  95%|█████████▌| 95/100 [14:12<00:43,  8.68s/it]Evaluating granite-leesplank:  96%|█████████▌| 96/100 [14:24<00:39,  9.75s/it]Evaluating granite-leesplank:  97%|█████████▋| 97/100 [14:35<00:30, 10.21s/it]Evaluating granite-leesplank:  98%|█████████▊| 98/100 [14:43<00:18,  9.38s/it]Evaluating granite-leesplank:  99%|█████████▉| 99/100 [14:54<00:10, 10.04s/it]2025-11-10 01:14:25 - INFO - Progress: 100/100, Avg SARI: 64.87
Evaluating granite-leesplank: 100%|██████████| 100/100 [15:04<00:00,  9.93s/it]Evaluating granite-leesplank: 100%|██████████| 100/100 [15:04<00:00,  9.05s/it]
2025-11-10 01:14:25 - INFO - Saved detailed results to evaluation_results/model_card_20251109_151419/greedy_speed/sari_benchmark_20251110_005420/granite-leesplank_results.csv
2025-11-10 01:14:25 - INFO - Saved predictions to evaluation_results/model_card_20251109_151419/greedy_speed/sari_benchmark_20251110_005420/granite-leesplank_predictions.jsonl
2025-11-10 01:14:25 - INFO - 
granite-leesplank Results:
2025-11-10 01:14:25 - INFO -   SARI Score: 64.87 ± 12.06
2025-11-10 01:14:25 - INFO -   Median SARI: 66.66
2025-11-10 01:14:25 - INFO -   Range: [36.12, 100.00]
2025-11-10 01:14:25 - INFO -   Generation Speed: 9.040s/sample
2025-11-10 01:14:25 - INFO - 
============================================================
2025-11-10 01:14:25 - INFO - COMPARATIVE ANALYSIS
2025-11-10 01:14:25 - INFO - ============================================================
2025-11-10 01:14:25 - INFO - 
SARI Score Comparison:
2025-11-10 01:14:25 - INFO -   eurollm-leesplank             :  66.69 ±  11.48
2025-11-10 01:14:25 - INFO -   granite-leesplank             :  64.87 ±  12.06
2025-11-10 01:14:25 - INFO - 
Best performing model: eurollm-leesplank (SARI: 66.69)
2025-11-10 01:14:25 - INFO - 
Performance difference: 1.81 SARI points
2025-11-10 01:14:25 - INFO - Approximate t-statistic: 1.088
2025-11-10 01:14:25 - INFO - Difference may not be statistically significant
2025-11-10 01:14:25 - INFO - 
Generation Speed Comparison:
2025-11-10 01:14:25 - INFO -   eurollm-leesplank             :  2.933s/sample
2025-11-10 01:14:25 - INFO -   granite-leesplank             :  9.040s/sample
2025-11-10 01:14:25 - INFO - 
Comparative analysis saved to evaluation_results/model_card_20251109_151419/greedy_speed/sari_benchmark_20251110_005420/comparative_analysis.json
2025-11-10 01:14:25 - INFO - Results saved to evaluation_results/model_card_20251109_151419/greedy_speed/sari_benchmark_20251110_005420
2025-11-10 01:14:25 - INFO - 
Evaluation complete! Results saved to evaluation_results/model_card_20251109_151419/greedy_speed/sari_benchmark_20251110_005420
